[
  {"documentId":"synthetic-clear-docx","sourceHash":"synthetic:clear-docx","page":1,"sourceOrder":1,"questionNumber":"1","stem":"清晰 DOCX 题干","options":["A","B","C","D"],"answer":"A","solution":"清晰解析","formulas":[],"images":[],"expectedSafePartial":false,"notes":"synthetic; not real quality evidence"},
  {"documentId":"synthetic-electronic-pdf","sourceHash":"synthetic:electronic-pdf","page":1,"sourceOrder":1,"questionNumber":"1","stem":"电子 PDF 题干","options":[],"answer":"","solution":"","formulas":[],"images":[],"expectedSafePartial":true,"notes":"synthetic"},
  {"documentId":"synthetic-scanned-pdf","sourceHash":"synthetic:scanned-pdf","page":1,"sourceOrder":1,"questionNumber":"1","stem":"扫描 PDF 题干","options":[],"answer":"","solution":"","formulas":[],"images":[],"expectedSafePartial":true,"notes":"synthetic"},
  {"documentId":"synthetic-skew","sourceHash":"synthetic:skew","page":1,"sourceOrder":1,"questionNumber":"1","stem":"歪斜页面","options":[],"answer":"","solution":"","formulas":[],"images":[],"expectedSafePartial":true,"notes":"synthetic"},
  {"documentId":"synthetic-low-resolution","sourceHash":"synthetic:low-resolution","page":1,"sourceOrder":1,"questionNumber":"1","stem":"低分辨率","options":[],"answer":"","solution":"","formulas":[],"images":[],"expectedSafePartial":true,"notes":"synthetic"},
  {"documentId":"synthetic-formula-heavy","sourceHash":"synthetic:formula-heavy","page":1,"sourceOrder":1,"questionNumber":"1","stem":"计算 $x^2$","options":[],"answer":"","solution":"$x=1$","formulas":["x^2","x=1"],"images":[],"expectedSafePartial":false,"notes":"synthetic"},
  {"documentId":"synthetic-geometry","sourceHash":"synthetic:geometry","page":1,"sourceOrder":1,"questionNumber":"1","stem":"几何图题","options":[],"answer":"","solution":"","formulas":[],"images":[{"id":"figure-1"}],"expectedSafePartial":true,"notes":"synthetic"},
  {"documentId":"synthetic-long-solution","sourceHash":"synthetic:long-solution","page":1,"sourceOrder":1,"questionNumber":"1","stem":"长解析题","options":[],"answer":"","solution":"第一步。第二步。第三步。","formulas":[],"images":[],"expectedSafePartial":false,"notes":"synthetic"},
  {"documentId":"synthetic-gap","sourceHash":"synthetic:gap","page":1,"sourceOrder":2,"questionNumber":"3","stem":"题号不连续","options":[],"answer":"","solution":"","formulas":[],"images":[],"expectedSafePartial":true,"notes":"synthetic"},
  {"documentId":"synthetic-known-bad","sourceHash":"synthetic:known-bad","page":1,"sourceOrder":1,"questionNumber":"1","stem":"known-bad","options":[],"answer":"","solution":"","formulas":[],"images":[],"expectedSafePartial":true,"notes":"synthetic fail-closed fixture"}
]
